{"channel_id":"control.commands","delivery":{"max_duplicate_count":0,"max_loss_ratio":0,"max_message_age_ms":100,"max_out_of_order_count":0,"message_id_attribute":"messaging.message.id","minimum_source_messages":20,"observation_window_sec":30},"destination":{"domain_id":"worker","message_type":"example_interfaces/msg/String","ros_domain_id":20,"topic":"/commands","type_hash":"RIHS01_1111111111111111111111111111111111111111111111111111111111111111"},"implementation_binding":{"configuration_sha256":"9ed86580a6d73075a4de9a241e9710ca771edc9a136a39a66658c7fcb23a3c2e","implementation_id":"zenoh_bridge_ros2dds","options":{"discovery_scope":"local_domain_only","key_expression":"robotics/control/commands"},"version":"1.9.0"},"qos":{"deadline_ms":100,"depth":10,"durability":"volatile","history":"keep_last","lifespan_ms":500,"liveliness":"automatic","liveliness_lease_duration_ms":"infinite","reliability":"reliable"},"schema_version":"transport-channel.v1","source":{"domain_id":"control","message_type":"example_interfaces/msg/String","ros_domain_id":10,"topic":"/commands","type_hash":"RIHS01_1111111111111111111111111111111111111111111111111111111111111111"},"trace":{"carrier_field":"trace_context","consumer_span_name":"commands receive","producer_span_name":"commands publish","relationship":"link"}}
